{
  "$schema": "https://json-schema.org/draft/2020-12/schema",
  "$id": "https://example.local/portable-graph.schema.json",
  "title": "Portable Graph",
  "type": "object",
  "additionalProperties": false,
  "required": ["schemaVersion", "nodes", "edges"],
  "properties": {
    "schemaVersion": {
      "type": "integer",
      "const": 1
    },
    "title": {
      "type": "string"
    },
    "nodes": {
      "type": "array",
      "items": {
        "type": "object",
        "additionalProperties": false,
        "required": ["id", "label", "position"],
        "properties": {
          "id": {
            "type": "string",
            "minLength": 1
          },
          "kind": {
            "type": "string",
            "enum": ["entry", "process", "exit", "group", "note"]
          },
          "label": {
            "type": "string"
          },
          "position": {
            "type": "object",
            "additionalProperties": false,
            "required": ["x", "y"],
            "properties": {
              "x": { "type": "number" },
              "y": { "type": "number" }
            }
          },
          "meta": {
            "type": "object"
          }
        }
      }
    },
    "edges": {
      "type": "array",
      "items": {
        "type": "object",
        "additionalProperties": false,
        "required": ["id", "from", "to"],
        "properties": {
          "id": {
            "type": "string",
            "minLength": 1
          },
          "from": {
            "type": "string",
            "minLength": 1
          },
          "to": {
            "type": "string",
            "minLength": 1
          },
          "label": {
            "type": "string"
          },
          "meta": {
            "type": "object"
          }
        }
      }
    }
  }
}
